{
  "severityText": "error",
  "body": "courier.email.deliver publish failed",
  "attributes": {
    "log.severity": "error",
    "service.name": "courier",
    "error.type": "dependency_unavailable"
  },
  "resource": {
    "service.name": "courier",
    "service.version": "0.2.4",
    "service.instance.id": "courier-9ac412",
    "deployment.environment": "production",
    "tenant_id": "acme"
  },
  "traceId": "4bf92f3577b34da6a3ce929d0e0e4736",
  "spanId": "00f067aa0ba902b7"
}
